{
  "type": "device.mic.test.start",
  "timestamp": "2026-03-20T10:06:00Z",
  "session_id": "550e8400-e29b-41d4-a716-446655440000",
  "sequence": 32,
  "version": "1.0",
  "payload": {
    "request_id": "hw-mic-001",
    "duration_ms": 1200,
    "sample_rate_hz": 16000,
    "frame_duration_ms": 20
  }
}
